{
  "skill": "otel-audit",
  "prompts": [
    {
      "id": "audit-metadata-capability",
      "eval_inputs": [
        "eval/inputs/audit-metadata-capability-evidence.json"
      ],
      "task": "Perform a focused read-only supplemental audit of audit-metadata-capability-evidence.json only. Its sources[].sections are lossless original helper/operation-primary/metadata/creation-source subtrees, addressed by original JSON pointers with origin_file/SHA provenance. Review each known, unavailable, dynamic, legitimate distinct-workflow and distinct-two-tool source separately; reconcile actual functions/calls, each available field and exact source value/owner, configured versus absent descriptions/models/context, current operation-specific official level, required profile, present/missing/proposed status and source-bound acceptance/proof. Assess the complete synthetic_field_acceptance_contract against actual source; parent-only metadata cannot close a tool field and unavailable values must remain unavailable. Use exact supplied newer operation-specific primary excerpts and source receipts when differing from the older general snapshot. For creator-stage facts inspect the installed public helper signature/source and creator_stage_source_acceptance now: distinguish initial kind/attributes and actual argument support from body/finalizer fields, completed/exported values and hypothetical sampler/on_start tests. Apply source observations to the concrete inspected helper, preserving supported same-span content capability and independent existing producers; no invented API parameters, private SDK edits, duplicate operations or executed sampling claims. Write only supplemental .observe/audit-metadata-capability.md and .observe/audit-metadata-capability.json with an overall scoped assessment and case-addressable field/proof details; equivalent precise Markdown/JSON/grouped evidence is allowed. Do not modify canonical live audit/selection/instrumentation/verification state or copy these synthetic operations/values into app.py findings. Do not modify/import/execute sources, inputs, app, dependencies, configuration/tests or installed packages; no services, models/cloud/network, browser/computer-use/UI. Source inspection is not installed app, capture, receiver, resource or cloud proof."
    }
  ],
  "judge_inputs": [
    "Read the single lossless input, loaded audit/reference instructions, supplemental Markdown/JSON and actor trace/final response/grade. Its origin/pointer sections replace the referenced original helper snapshot; all prior values, source code, primary excerpts, hashes and acceptance contracts are intact.",
    "Assess every requested context and each actual field on its owning operation: known_context, unavailable_context, dynamic_model_context, distinct_workflow_agent_context and both distinct_tool_metadata_context calls. Accurate field/proof judgments in any generated artifact satisfy the check; separate JSON rows, exact headings or literal source quotations are not required. Source-set fields must not be falsely classified missing just because runtime export is unobserved.",
    "A metadata policy summary is not assessment of every available source value/official-level/proof. Distinguish each described tool, fixed-model versus dynamic agent, actually configured description versus prose, and initial-creation versus finalizer capability. Never infer sampler execution or completed app/runtime/receiver/cloud from these source facts.",
    "Grade every one of the four listed criteria once with exactly four checks; do not inherit the old thirteen-criterion count or silently omit failed checks."
  ],
  "rubric": [
    "Assesses known metadata on its owning operation in the separate synthetic known_context source: tool execution knows active agent name, supplied approved opaque conversation ID and offered description, and the in-process fixed single-model agent knows its explicitly configured description and qwen3:8b model. Reports these missing same-operation fields explicitly (gen_ai.agent.name, gen_ai.conversation.id, gen_ai.tool.description on tools; gen_ai.agent.description and fixed-only gen_ai.request.model on the INTERNAL agent), with actual source/value origin and source-bound acceptance or proof plan. Preserves exact4e8 primary operation levels: tool agent name/conversation are Conditionally Required when applicable/available; tool description and fixed single-model INTERNAL-agent configured model are Recommended when applicable, while the skill profile requires those known values. Parent/model-only fields or inheritance assumptions do not close the tool's fields. Does not attribute synthetic values to app.py or the original installed capture, fabricate them for unavailable_context, or use correlation as metric dimensions. Distinguishes proposed fields from actual capture/receiver proof. Reconciles the supplied synthetic_field_acceptance_contract with the actual source and pinned primary rows, explicitly accounting for every configured value and its owning span. A generic metadata/applicability summary cannot replace the available field/value/source/level/profile/proof assessment; equivalent precise prose or structures are accepted without prescribing headings. The ledger also records source-set tool type/name and present-versus-missing status accurately; do not mark a field missing merely because its runtime/export proof is absent.",
    "Applies the current INTERNAL-agent footnote637: dynamic_model_context supports multiple/per-turn model selection, so reserved gen_ai.request.model is not applicable on its agent span even though each inference must carry its actual chosen model. Does not fabricate a fixed agent model from a default or one selected request; an optional application/vendor context field must retain its own provenance. Configured agent description is distinct from general README prose, a prompt paraphrase or a guessed function purpose; require the actual configured value when provided and preserve unavailable status when none is configured.",
    "In the contrasting distinct_tool_metadata_context, independently assess both read_health and read_queue execute_tool calls with their own offered descriptions, shared source-known Status Desk identity and approved opaque conversation binding. Do not copy one tool description onto the other, close both with one container summary, fabricate an agent description/model, or attribute this context to app.py; use the actual pinned tool levels and explicit source/proposed/runtime status. Record field/value/source/official-level/profile/proof for every supplied field on each of the two tools independently; equivalent grouped Markdown/JSON is accepted when distinct field ownership remains explicit.",
    "Separately audits creation-time metadata/kind capability using the exact pinned official sampling guidance and installed0.5 helper source/signature. Identifies that start_splunk_ao_span starts with name only and applies semantic attributes after yielding/finalization; completed/exported enrichment and wire-kind correction cannot repair earlier head-sampler or on_start attributes/kind. Requires available sampling metadata at creation through a verified supported producer hook, or records the exact per-version API limitation and separate unresolved creation-time proof. Does not invent helper kind/attributes parameters, patch SDK internals, rewrite sampling decisions, add duplicate producer spans or silently call all semantic requirements complete because a final export looks correct. Keeps this scoped limitation distinct from supported helper same-span content/null capability and other actionable independent findings. Source inspection is not an executed sampler/on_start test; runtime closure requires the actual creation boundary to be observed in addition to final-span assertions. Reconciles creator_stage_source_acceptance with the actual helper source: factual name-only initial call/no initial attributes or explicit kind, yield followed by finally build_span_attributes/set_attribute, and the absent public parameters. Equivalent precise evidence is accepted; do not fail solely for missing a literal code quotation or one table format. Conditional wording about a future unsupported SDK does not classify the already-inspected0.5 path."
  ]
}
