{
  "skill": "otel-instrument",
  "prompts": [
    {
      "id": "direct",
      "task": "Add OpenTelemetry instrumentation to the plain Java Kafka batch consumer service in ./service. Preserve the ConsumerRecords batch-processing and commitSync behavior. Prefer Java agent auto-instrumentation for Kafka clients; do not add custom spans or metrics unless explicitly required."
    },
    {
      "id": "runtime-preserving",
      "task": "Instrument the plain Java Kafka batch consumer service in ./service while preserving the existing Maven runtime, Kafka topic, batch-poll loop, and offset commit behavior. Prefer the OpenTelemetry Java agent, include fast local metric export settings for development use, and avoid unnecessary application code changes."
    }
  ],
  "judge_inputs": [
    "Inspect ./service for resulting files when present.",
    "Read ./last_message.md for the agent final response.",
    "Read ./grade.json for run guard checks."
  ],
  "rubric": [
    "Performs a Java trace wiring inventory covering Maven dependencies, JAVA_TOOL_OPTIONS or -javaagent startup, OTEL_* configuration, Kafka consumer batch code, and existing Tracer usage, then classifies the pre-change fixture as missing based on evidence.",
    "Preserves BatchConsumerApplication.java, PaymentBatchConsumer.java, PaymentBatchProcessor.java, the payments topic, batch-poll loop, and commitSync behavior.",
    "Uses or recommends the OpenTelemetry Java agent in the existing Maven/Java startup path with OTEL_SERVICE_NAME, OTEL_EXPORTER_OTLP_ENDPOINT, OTEL_METRIC_EXPORT_INTERVAL=1000, and OTEL_METRIC_EXPORT_TIMEOUT=500.",
    "Does not add OpenTelemetrySdk, a duplicate provider, broad manual tracing, or custom Tracer creation when no custom spans are requested.",
    "Mentions that Kafka consumer spans come from the Java agent and treats batch size, failed-record count, commit latency, and high-value-payment metrics as optional business instrumentation unless explicitly requested."
  ]
}
