{
  "skill": "otel-instrument",
  "prompts": [
    {
      "id": "native-agent-resource-defaults",
      "task": "Use $otel-audit ./service, then use the bundled selection flow to select the resulting project, dedicated stream and runtime-routing configuration findings and their required executable prerequisites. Implement that selected work with $otel-instrument. Preserve existing native OTel creators/providers/exporters and legitimate sinks; do not install splunk-ao or migrate to another producer. Use actual supported native libraries in an isolated compatible environment and numeric-loopback fake resource/OTLP boundaries; no live model/cloud credentials or browser/UI. Execute the written resource bootstrap and actual application launch/profile to prove both-existing, both-missing, mixed, repeat reuse, wrong project, unknown IDs, duplicate-create recovery and lookup/create failure isolation. Real resolved UUIDs must reach the actual existing HTTP trace exporter through loaded trace-specific headers before export, preserving endpoint/protocol/nondefault port and harmless inherited headers while keeping those route/auth fields out of metrics/local logs. Inspect actual emitted payloads and headers, source startup/flush/shutdown and one canonical operation per boundary. Keep independently supplied role or coverage changes outside selected scope unless they are actual routing prerequisites. Record exact local commands and remaining remote proof; fake receipt is not real cloud visibility. Also run the actual written bootstrap and launcher in connected, running-disconnected (resource API503 with ordinary OTLP available), unavailable and reconnected fake Studio modes. For disconnected/reconnect cases retain a previously validated same-destination UUID pair in headers and trace Resources. Separately start names-only with existing resources and initial503; enable the configured API in the same PID, require automatic exact scoped reuse with zero creates and complete live binding, and prove native local signals and business behavior. Also start a fresh process with a previously validated complete same-destination binding and unavailable resource API; subsequent routed exports must retain that binding without requiring successful relookup. Resolve names-only or changed/rejected identity cases within their correct scope, with zero duplicate creates; do not count retained bindings as newly resolved resource evidence. No fake IDs or direct-cloud fallback; report unavailable receiver/cloud proof honestly."
    }
  ],
  "judge_inputs": [
    "Inspect actual source/configuration diff, canonical audit/selection/report digests, real local bootstrap/API/export requests, and executed app startup/profile tests."
  ],
  "rubric": [
    "Audit makes project, dedicated stream and routing default configuration findings even for a bare native OTel agent with no AO import/request/configuration; selection contains those IDs and justified executable prerequisites with canonical bindings.",
    "Implements resource resolution through supported SDK-free interfaces, preserving native producers/providers/exporters and real endpoints/protocol/nondefault port. No splunk-ao dependency, second provider or duplicate destination export is introduced. Any startup repair is limited to source-proven prerequisites.",
    "Actually executes written bootstrap and local HTTP API cases for reuse/create/mixed/repeat, ownership, lookup-only IDs, duplicate/uncertain outcome relookup, lookup/create failures and ordinary-telemetry continuation. Fake SDK modules or replacement resolver logic do not prove the actual path.",
    "Actual application launch loads persisted resolved UUIDs into OTEL_EXPORTER_OTLP_TRACES_HEADERS or the existing supported constructor hook before export; captured native trace HTTP requests contain correct projectid/logstreamid for the chosen Studio contract. Tests preserve harmless generic fallback/trace-specific precedence and prove no route/auth leakage into metrics/logs. Unused example env assignments or direct environment injection that bypasses the written launcher are insufficient.",
    "Native operation/export receipts, flush/shutdown and source-bound reports prove local configuration/runtime outcomes without inventing model or remote resource/trace visibility. Remote exact destination trace proof remains explicitly Not proven or Blocked; report unselected gaps separately and do not claim full readiness from unit/source/HTTP acknowledgement.",
    "Actual bootstrap/launch tests prove connected routed UUID headers, running-disconnected resource503 with zero create calls and ordinary local agent telemetry/business continuation, Studio-unavailable local/in-memory execution with receiver receipt blocked, and recovery with stable IDs/zero duplicate creates. A previously validated complete same-destination binding works across reconnect and new launches without gating exports on resource relookup; names-only and changed/rejected identity cases require their distinct scoped resolution path. Previously validated same-destination IDs remain in headers and trace Resources during503; unknown names remain selectors and recover automatically in one PID without manual setup. Harmless headers and unrelated sinks survive. Local emission and routed/cloud outcomes are independently reported, without silent destination changes or fabricated delivery."
  ]
}
