{
  "skill": "otel-audit",
  "prompts": [
    {
      "id": "finding-group-audit",
      "eval_inputs": [
        "eval/inputs/finding-group-snapshot.json"
      ],
      "task": "Supplemental report-contract review only. Read the loaded skill shared ../references/report-flow-contract.md and ./service/eval/inputs/finding-group-snapshot.json. Review all six supplied projections; do not perform the usual audit, instrumentation, verification, or configure workflow. Do not invoke a browser, application, SDK, cloud API, Terraform, or a new normalizer/renderer. Write only ./service/.observe/finding-group-review.json and .md. For every record assess the rendered_cards_html against the loaded contract, rather than assuming display_finding_ids describes the actual DOM projection. Record accepted, rendered_card_ids, ordinary_ids, ao_ids, and specific violations. Address group membership, priority and canonical tie order, repeated/empty subsection headings, and the two ID-prefix counterexamples. Preserve all IDs and distinguish presentation from canonical audit/selection identity. Record the supplied engine SHA and actual identity_checks, including requested_ids versus approved_ids and their digests. Classify this as supplied Python/Node VM evidence with a stub card renderer; it is not a live browser, selection-control interaction, application, or cloud proof and you execute no new engine run. State proof limits accurately. Explain how this affects audit authoring: use the explicit finding_group for display; preserve source-backed finding scope and IDs; a report projection does not create a new source scan or approve work. Also review required_inputs_cases and required_input_groups from the supplied snapshot. Explain which selected scopes require inputs, what missing-input prompt is needed, how generic-partial asks only for Cluster, and why policy-only reuse does not bypass required values. Callback/content AO requires a destination even when resource_routing_selected is false; the pair must not select resource work. The current report puts required destination controls first in the AO subsection, before cards. Preserve legacy normalization/digest compatibility while distinguishing readiness for a new instrumentation run. Describe the generic instrumentation procedure: collect only missing fields across selected work, ask and wait, rebind supplied values preserving scope/answers/metadata, validate and recheck before edits. Do not claim these supplied status results executed that conversational workflow. Explicitly explain why missing user choices cannot be supplied by automatic defaults or environment-variable fallback; asking and waiting must precede rebinding and application/config/dependency/provisioning edits."
    }
  ],
  "judge_inputs": [
    "Inspect ./service/eval/inputs/finding-group-snapshot.json and the loaded shared report-flow contract. Compare all per-record conclusions with canonical finding_group/priority/order and actual rendered_cards_html.",
    "Read ./service/.observe/finding-group-review.json/.md, ./last_message.md and ./grade.json. Check role-specific scope implications and source/proof provenance; no runtime workflow was requested."
  ],
  "rubric": [
    "Correctly accepts record-a, record-d, record-e and record-f; rejects record-b because priority-first interleaving splits ordinary OTel cards and repeats the AO subsection, and record-c because ID-prefix classification moves cards into the wrong category. Grounds each decision in actual rendered markup and finding fields, rather than a generic grouping statement or trusting display_finding_ids alone.",
    "Keeps all ordinary OTel cards together before one AO subsection, ordered required/recommended/deferred within each group with canonical ties stable. Ordinary-only output has no empty AO heading; AO-only output has exactly one heading; empty output has no cards or fabricated group. Correctly handles AO-777 as ordinary and OTEL-777 as AO from finding_group, preserving IDs and expected count with no omitted or duplicate cards.",
    "Retains canonical finding order and identity, actual audit/selection digests, and requested versus dependency-closed approved IDs from identity_checks. Explains that view sorting cannot mutate canonical data, rename findings, reset selections or expand scope. Uses the real supplied closure rather than treating screen order as dependency or selection order.",
    "Accurately records producer provenance and limits: the supplied normalizer and real renderCards were executed in Python/Node VM with stub article markup; this consuming review ran no new engine or browser and proves no UI-control behavior, telemetry receipt, SDK resource creation, metric coverage or cloud delivery. Only the two requested review artifacts are written.",
    "Explain how this affects audit authoring: use the explicit finding_group for display; preserve source-backed finding scope and IDs; a report projection does not create a new source scan or approve work.",
    "Correctly interprets all required_inputs_cases: ordinary-only and ordinary-ao-prefix need no AO destination; agent-targetless, agent-policy-only and callback-targetless need both Project and Agent Stream; complete name/ID or mixed pairs are ready. Callback-complete does not select resource/routing work. Explains both-blank and reuse-only are blocked for new instrumentation, while legacy packet normalization and digests remain valid. Required controls belong first inside the AO subsection before cards.",
    "Explains the generic required-input workflow using actual missing_inputs/prompt: generic-partial asks only for Cluster, and supplied fields are not asked again. Missing user choices require a focused prompt and an answer before application/config/dependency/provisioning edits; no default or env fallback. After answers, rebind while retaining requested IDs, decisions and approval metadata, validate and recheck ready. Does not claim this read-only review proves a live conversation or cloud execution."
  ]
}
